{
  "targets": {
    "prod": {
      "host": "your.server.com",
      "user": "ubuntu",
      "port": 22,
      "identity": "~/.ssh/id_ed25519",
      "cwd": "/home/ubuntu/strapi",
      "pm2": "strapi-frontend"
    }
  },
  "healthcheck": {
    "urls": [
      "http://127.0.0.1:3000/",
      "http://127.0.0.1:3000/sitemap.xml"
    ]
  },
  "revalidate": {
    "endpoint": "https://minokamo.xyz/api/revalidate",
    "secret": "change_me"
  },
  "deploy": {
    "build": "pnpm build",
    "start": "pnpm start",
    "pm2": "strapi-frontend"
  }
}